"id","company"
"mmm52","compania del boleo"
"mmm54","compania del boleo"
"mmm55","compania del boleo"
"mmm56","compania del boleo"
"mmm62","compania del boleo"
"mmm63","compania del boleo"
"mmm64","compania del boleo"
"mmm65","compania del boleo"
"mmm128","cia minera de plomozinc s a "
"mmm129","cia minera de plomozinc s a "
"mmm130","cia minera de plomozinc s a "
"mmm131","cia minera de plomozinc s a "
"mmm283","the concheno mining company"
"mmm283","the concheno mining company"
"mmm283","the concheno mining company"
"mmm283","the concheno mining company"
"mmm284","the concheno mining company"
"mmm289","the concheno mining company"
"mmm321","compania exploradora y explotadora de minas s a "
"mmm323","compania exploradora y explotadora de minas s a "
"mmm324","compania exploradora y explotadora de minas s a "
"mmm325","compania exploradora y explotadora de minas s a "
"mmm331","compania exploradora y explotadora de minas s a "
"mmm332","compania exploradora y explotadora de minas s a "
"mmm334","compania minera de minerales s a "
"mmm335","compania minera de minerales s a "
"mmm336","compania minera de minerales s a "
"mmm337","compania minera de minerales s a "
"mmm341","cia metalurgica mexicana san pedro mines"
"mmm356","cia minera el barreno y anexas s a "
"mmm357","cia minera el barreno y anexas s a "
"mmm358","cia minera el barreno y anexas s a "
"mmm489","compania minera y beneficiadora mexicana s a "
"mmm490","compania minera y beneficiadora mexicana s a "
"mmm491","compania minera y beneficiadora mexicana s a "
"mmm492","compania minera y beneficiadora mexicana s a "
"mmm493","compania minera y beneficiadora mexicana s a "
"mmm494","compania minera y beneficiadora mexicana s a "
"mmm497","compania minera y beneficiadora mexicana s a "
"mmm657","guanajuato reduction mines company"
"mmm657","nueva luz mining company"
"mmm907","cinco mines company"
"mmm908","cinco mines company"
"mmm910","cinco mines company"
"mmm911","cinco mines company"
"mmm913","cinco mines company"
"mmm914","cinco mines company"
"mmm1029","compania esperanza s a "
"mmm1031","compania esperanza s a "
"mmm1032","compania esperanza s a "
"mmm1034","compania esperanza s a "
"mmm1035","compania esperanza s a "
"mmm1037","compania esperanza s a "
"mmm1038","compania esperanza s a "
"mmm1039","compania esperanza s a "
"mmm1043","compania esperanza s a "
"mmm1044","compania esperanza s a "
"mmm1047","compania esperanza s a "
"mmm1048","compania esperanza s a "
"mmm1399","cia minera la soledad s a "
"mmm1400","cia minera la soledad s a "
"mmm1401","cia minera la soledad s a "
"mmm1448","nueva compania de san vicente"
"mmm1449","nueva compania de san vicente"
"mmm1451","nueva compania de san vicente"
"mmm1453","nueva compania de san vicente"
"mmm1747","shannon copper company"
"mmm1748","shannon copper company"
"mmm1957","companía carbonifera de sabinas s a "
"mmm1959","companía carbonifera de sabinas s a "
"mmm1960","companía carbonifera de sabinas s a "
"mmm1961","companía carbonifera de sabinas s a "
"mmm1965","companía carbonifera de sabinas s a "
"mmm1977","velardena"
"mmm1979","velardena"
"mmm1980","velardena"
"mmm1980","velardena"
"mmm1980","velardena"
"mmm1980","velardena"
"mmm1985","velardena"
"mmm1987","velardena"
"mmm1994","velardena"
"mmm1996","velardena"
"mmm2146","monterey smelting refining company"
"mmm2148","monterey smelting refining company"
"amm100000","palmarejo mexican gold fields ltd"
"amm100002","palmarejo mexican gold fields ltd"
"amm100003","palmarejo mexican gold fields ltd"
"amm100004","palmarejo mexican gold fields ltd"
"amm100005","palmarejo mexican gold fields ltd"
"amm100078","cia minera de san patricio s a "
"amm100080","cia minera de san patricio s a "
"amm100081","cia minera de san patricio s a "
"amm100082","cia minera de san patricio s a "
"amm100083","cia minera de san patricio s a "
"amm100175","coahuila coal company"
"amm100230","a vino mines ltd"
"amm100232","a vino mines ltd"
"amm100306","sonora mining company"
"amm100324","augustias dolores mining company"
"amm100345","esperanza mining company"
"amm100350","esperanza mining company"
"amm100443","hidalgo copper mining smelting company"
"amm100444","hidalgo copper mining smelting company"
"amm100445","hidalgo copper mining smelting company"
"amm100450","hidalgo copper mining smelting company"
"amm100458","maravillas san francisco mining milling company"
"amm100632","mexico mines company"
"amm100634","mexico mines company"
"amm100639","mexico mines of el oro ltd"
"amm100640","mexico mines of el oro ltd"
"amm100641","mexico mines of el oro ltd"
"amm100642","mexico mines of el oro ltd"
"amm100653","el oro mining railway company"
"amm100655","el oro mining railway company"
"amm100656","el oro mining railway company"
"amm100657","el oro mining railway company"
"amm100660","el oro mining railway company"
"amm100681","mexico mines of el oro ltd"
"amm100682","mexico mines of el oro ltd"
"amm100683","mexico mines of el oro ltd"
"amm100791","monterey iron steel company"
"amm100793","monterey iron steel company"
"amm100800","monterey iron steel company"
"amm100970","cinco de mayo mine pilares de teras lgp"
"amm10099","argus mining company"
"amm10100","argus mining company"
"amm101145","dos estrellas mining company"
"amm101147","dos estrellas mining company"
"amm10195","concord mining company"
"amm10246","reforma mining milling company"
"amm10286","american boy mine patagonia "
"amm1031","stevens copper mining company"
"amm10315","bear creek mining company"
"amm10317","bonanza gold mines ltd"
"amm1032","stevens copper mining company"
"amm10386","tin era mines ltd"
"amm1039","superior boston copper company"
"amm10394","dante gold mining company"
"amm10397","dante gold mining company"
"amm1040","superior boston copper company"
"amm10472","kamloops mines british columbia ltd"
"amm10560","northern mines company"
"amm10577","burns mining company"
"amm1060","trenton mining development company"
"amm1061","trenton mining development company"
"amm1062","trenton mining development company"
"amm10665","dou aria mines company"
"amm10688","wheal peevor mining company"
"amm1069","twin buttes mining sm elting company"
"amm1070","twin buttes mining sm elting company"
"amm1071","twin buttes mining sm elting company"
"amm1072","twin buttes mining sm elting company"
"amm10729","gaika gold mining company"
"amm10730","gaika gold mining company"
"amm10743","moser river syndicate ltd"
"amm10818","colonial silver mines cobalt fgp"
"amm10823","copper mining smelting ontario ltd"
"amm10824","copper mining smelting ontario ltd"
"amm10841","gruss mining company"
"amm10855","lawyers mining company"
"amm10873","medina gold mines ltd"
"amm1091","arizona vermont copper company"
"amm10961","temagam mining company"
"amm10975","iron mines"
"amm10997","black lake asbestos chrome company"
"amm11026","abercrom bie copper mines ltd"
"amm11091","pikes peak cons fuel company"
"amm11093","pocahontas coal coke company"
"amm11106","coal mines colorado "
"amm11110","coal mines colorado "
"amm11149","cokedale coal company"
"amm11150","cokedale coal company"
"amm11154","montana clinton mining company"
"amm11169","tarryall creek gold company"
"amm11172","american flag mining company"
"amm11199","st louis rocky mountain g pacific company"
"amm11200","st louis rocky mountain g pacific company"
"amm11315","saddle hill coal company"
"amm11375","wellington colliery stopes ltd"
"amm11384","imperial coal coke company"
"amm11413","inverness railway and coal ltd"
"amm11418","maritime coal railway power company"
"amm11469","british guiana gold mines ltd"
"amm11470","british guiana gold mines ltd"
"amm11573","lewis river dredging mining company"
"amm116","alaska treasure consolidated mines company"
"amm11605","princeton mining g milling company"
"amm11606","princeton mining g milling company"
"amm11646","victoria copper mining company"
"amm11683","antelope gold mine rhodesia ltd"
"amm11695","arizona cananea mines company"
"amm117","alaska treasure consolidated mines company"
"amm11703","arizona commercial mining company"
"amm11704","arizona commercial mining company"
"amm11705","arizona commercial mining company"
"amm11721","arizona copper company"
"amm11747","clifton morenci copper company"
"amm11749","arizona nevada consolidated goldfield mining company"
"amm11750","arizona nevada consolidated goldfield mining company"
"amm11751","arizona prospecting and developing gold"
"amm11757","arizona united mining company"
"amm11758","arizona united mining company"
"amm11760","arizona united mining company"
"amm11764","cleveland arizona mining company"
"amm11766","arizona michigan mining company"
"amm11778","august mining company"
"amm11786","barn ey copper company"
"amm11836","bowyer gold a copper company"
"amm11903","cerro colorado mine company"
"amm11904","cerro colorado mine company"
"amm11935","copiapo mining company"
"amm11965","commonwealth mining company"
"amm11969","congress consolidated mines company"
"amm11970","congress consolidated mines company"
"amm11986","consolidation coal company"
"amm12010","copper reef consolidated mines company"
"amm12022","carney copper company"
"amm12080","dan creek mining company"
"amm12102","evenoes miningsyndicate ltd"
"amm12119","flora gold mining company"
"amm12120","flora gold mining company"
"amm12129","frontier mining company"
"amm12130","frontier mining company"
"amm12137","ray central copper mining company"
"amm12157","gold belt develonment fc reduction company"
"amm12159","gold peak mining company"
"amm12160","gold peak mining company"
"amm12161","gold crown mining reduction company"
"amm12168","gold coin mining company"
"amm1217","birdseye creek gold mining ltd"
"amm12219","hercules mining company"
"amm12220","hercules mining company"
"amm12224","hercules mining company"
"amm1226","belorophan mining company"
"amm1227","belorophan mining company"
"amm12326","lakes mines company"
"amm12356","mudsill mining company"
"amm1238","brooklyn mining company"
"amm12382","maria consolidated mining company"
"amm1239","brooklyn mining company"
"amm12397","arizona michigan mining company"
"amm1240","brooklyn mining company"
"amm12404","midnight mine chloride "
"amm12408","midnight test mine groom creek lc"
"amm12416","minnesota arizona gold mining company"
"amm12422","mint gold mining company"
"amm12423","mint gold mining company"
"amm12472","new england gold copper mining company"
"amm12491","newbrough mining company"
"amm12500","wah chang mining smelting company"
"amm12535","baker mines company"
"amm12537","paymaster mining smelting company"
"amm12538","paymaster mining smelting company"
"amm1267","calaveras gold dredging company"
"amm12679","stafford gold company"
"amm1268","calaveras gold dredging company"
"amm12680","stafford gold company"
"amm12687","stevens copper mining company"
"amm12711","superstition mining company"
"amm12727","telluride mining milling dev company"
"amm12728","telluride mining milling dev company"
"amm12745","tombstone consolidated mines company"
"amm12752","towne mine chloride "
"amm12758","tube city mining company"
"amm12760","tube city mining company"
"amm12765","twin buttes mining sm elting company"
"amm12775","united globe mines globe ahd"
"amm12781","united gold s silver mining company"
"amm12813","arizona vermont copper company"
"amm12815","victor a belle crown mining company"
"amm1284","cumbrian mining company"
"amm12843","worlds fair mine patagonia "
"amm1285","cumbrian mining company"
"amm12852","emma copper company"
"amm12879","amador gold mine ltd"
"amm12880","amador gold mine ltd"
"amm12894","ancho mine graniteville lgp"
"amm12916","orient gold mines ltd"
"amm12984","ben franklin gold mining company"
"amm13012","black bear consolidated mining company"
"amm13035","blue canon mining development company"
"amm13049","blue bell mining company"
"amm13050","blue bell mining company"
"amm13051","bella vista mining company"
"amm13077","brooklyn mining company"
"amm13080","brooklyn mining company"
"amm13111","bunker hill consolidated mining company"
"amm13112","bunker hill consolidated mining company"
"amm13172","california mountain mining company"
"amm13173","california mountain mining company"
"amm13241","central mother lode quartz mining company"
"amm13252","cherokee gravel gold mining company"
"amm13272","climax mine cacoctin yavapai company"
"amm13279","cloverfield mines ltd"
"amm13280","cloverfield mines ltd"
"amm13345","del monte mining milling company"
"amm13354","depot hill mine camptonville lc"
"amm13383","eagle shamut mining company"
"amm13384","eagle shamut mining company"
"amm13388","west africa development syndicate ltd"
"amm13404","eldorado placer counties gold mining power company"
"amm13425","amparo mining company"
"amm13442","escondido mining company"
"amm13446","ousby mining company"
"amm13456","exchequer mining company"
"amm13488","fearless mining company"
"amm13490","fearless mining company"
"amm13527","genesee valley copper company"
"amm13538","globe mines dedrick california "
"amm13569","gold mountain hydraulic dredging company"
"amm13570","gold mountain hydraulic dredging company"
"amm1360","confidence gold mines corporation confidence mgp"
"amm1361","confidence gold mines corporation confidence mgp"
"amm1362","confidence gold mines corporation confidence mgp"
"amm13622","golden rule mines ltd"
"amm13626","golden state mlnes ltd"
"amm13628","golden west mining company"
"amm13637","garbutt mining company"
"amm13638","garbutt mining company"
"amm13652","criterion gold mining company"
"amm13653","criterion gold mining company"
"amm13669","queen mining company"
"amm13670","queen mining company"
"amm13679","kennedy company"
"amm1368","copper queen gold mining company"
"amm13680","kennedy company"
"amm13685","hay seed mining company"
"amm1369","copper queen gold mining company"
"amm13690","helen mine middletown fgp"
"amm13699","hidden treasure gold mining company"
"amm13700","hidden treasure gold mining company"
"amm13716","horseshoe bar mine galice lc"
"amm13725","idaho maryland mines company"
"amm13726","idaho maryland mines company"
"amm13733","indian girl mine hornbrook i"
"amm13778","j uiia mining company"
"amm13800","concho mining company"
"amm13815","gold key mining company"
"amm13826","la cruz mining company"
"amm13851","lecompton gold mining company"
"amm13920","marble springs gold mines company"
"amm13971","moonlight mining company"
"amm14002","mount gaines consolidated mining company"
"amm14027","mountain monarch mining company"
"amm14038","murchie mine nevada city lgp"
"amm14096","neden copper company"
"amm14141","oceanic mine cambria murray dhd innes owner "
"amm14144","omega gold mining company"
"amm14176","original amador cons mines company"
"amm14206","pacific mines corporation stagg egd"
"amm14208","pacific mines corporation stagg egd"
"amm14244","baker gold mining company"
"amm14269","pocahontas copper queen mining company"
"amm14270","pocahontas copper queen mining company"
"amm14273","company ltd martinez contra costa company a "
"amm14305","queen esther mining company"
"amm14318","round hill mining company"
"amm14359","richmond consolidated mining company"
"amm14360","richmond consolidated mining company"
"amm14390","st johns consolidated quicksilver mining company"
"amm14400","san jose mining company"
"amm14403","santa isabel mining milling company"
"amm14438","sheepranch gold mining company"
"amm14440","sheepranch gold mining company"
"amm14443","sherman mining company"
"amm14479","scotia mines company"
"amm14480","scotia mines company"
"amm14524","spring garden cons placer mines company"
"amm14531","standard amalgamated exploration company"
"amm14532","standard amalgamated exploration company"
"amm14588","soux mining company"
"amm14590","table mountain gold mining company"
"amm14631","trinity dredging company"
"amm14685","viloro syndicate ltd"
"amm14705","yerington mountain copper company"
"amm14720","ella b mining company"
"amm1473","ymir gold mines ltd"
"amm1474","ymir gold mines ltd"
"amm14790","allemont mining syndicate company"
"amm14861","eureka leasing company"
"amm14868","argonaut gold ltd"
"amm14894","bangor mining company"
"amm14899","presidio mining company"
"amm14900","presidio mining company"
"amm14902","bassick gold mining company"
"amm14950","boston colorado smelting company"
"amm14969","plein mining dredging company"
"amm14970","plein mining dredging company"
"amm14982","california milling and mining company"
"amm14983","california milling and mining company"
"amm1500","fairview mining company"
"amm1501","fairview mining company"
"amm1502","fairview mining company"
"amm15035","champion mining company"
"amm15062","golconda mining milling company"
"amm15100","colorado smelting mining company"
"amm15163","crescent mining company"
"amm15202","denver mining milling company"
"amm15217","decatur copper mining company"
"amm15244","eagle mining improvement company"
"amm15260","elk mountain mines company"
"amm15267","elkton consolidated mining milling company"
"amm15268","elkton consolidated mining milling company"
"amm15328","flora belle mining company"
"amm15330","flora belle mining company"
"amm15354","frontenac consolidated mines ltd"
"amm15375","giant eclipse consolidated mines company"
"amm1540","griffin mining company"
"amm1541","griffin mining company"
"amm15415","gold king extension mines company"
"amm15416","gold king extension mines company"
"amm15425","gold run mining company"
"amm15457","good luck mining company"
"amm15496","hampton consolidated ltd"
"amm15536","homestake gold mining company"
"amm15537","homestake gold mining company"
"amm15583","intersection leasing company"
"amm15591","iron springs consolidated mining company"
"amm15627","jewell tunnel a mining company"
"amm15643","hondo gold mining company"
"amm15668","kuenzel s process smelting company"
"amm15670","kuenzel s process smelting company"
"amm15674","lake city mining company"
"amm15717","little kingdom land at mines company"
"amm15767","marquette gold mining milling company"
"amm15825","monarch consolidated gold copper mining smelting company"
"amm15826","monarch consolidated gold copper mining smelting company"
"amm15831","monmouth mining development company"
"amm1586","gopher boulder mine kelsey via placerville lgp"
"amm15861","mountain flower gold m m g p company"
"amm15946","old town consolidated mining company"
"amm15969","erie consolidated mines company"
"amm15970","erie consolidated mines company"
"amm15977","boras leasing company"
"amm15993","penobscot mining company"
"amm16001","perigo mines gilpin fgp"
"amm16007","pharmacist consolidated mining company"
"amm16021","berryman mining company"
"amm16035","preston gold mining milling company"
"amm16048","prince arthur mining milling company"
"amm16050","princess alice consolidated gold mining company"
"amm16071","red mountain railroad mining smelting company"
"amm16085","reliance gold mining company"
"amm16155","spearhead gold mining company"
"amm16157","senator gold mining milling company"
"amm16185","salida mining company"
"amm16224","star consolidated mines company"
"amm16227","stratton s cripple creek mining development company"
"amm16254","sunnyside mines eureka dgd"
"amm16269","tripoli mining company"
"amm16270","tripoli mining company"
"amm16319","iona gold mining company"
"amm16320","iona gold mining company"
"amm16329","colorado united mines company"
"amm16330","colorado united mines company"
"amm16391","wagner mining company"
"amm1642","crown mountain gold mining company"
"amm16454","simau mining company"
"amm16473","franklin gold mining company"
"amm16503","american placer mining company"
"amm16522","basler mining development company"
"amm16545","black pearl mining company"
"amm16618","consolidated diamond mining company"
"amm16662","garfield mining company"
"amm1668","hidden treasure gold mining company"
"amm1669","hidden treasure gold mining company"
"amm16691","granite hill mining company"
"amm16716","hill city mining development company"
"amm16748","idaho gold silver mines ltd"
"amm16750","idaho gold silver mines ltd"
"amm16811","lost packer mining company"
"amm16812","lost packer mining company"
"amm16823","murray hill mining company"
"amm16827","melcher mining a milling company"
"amm16830","metallic mining company"
"amm16861","b h mining company"
"amm16865","national copper mines company"
"amm16875","olympia mining milling company"
"amm1689","idaho maryland mines company"
"amm16895","bajo mining company"
"amm1690","idaho maryland mines company"
"amm1691","idaho maryland mines company"
"amm1692","indiana gold dredging company"
"amm1693","indiana gold dredging company"
"amm16958","snow storm mining company"
"amm16960","snow storm mining company"
"amm1726","kern county consolidated gold mines"
"amm1727","kern county consolidated gold mines"
"amm17310","adventure consolidated copper company"
"amm17311","adventure consolidated copper company"
"amm1743","leppen gold mining syndicate ltd"
"amm1744","leppen gold mining syndicate ltd"
"amm17525","desloge consolidated lead company"
"amm17617","ibex mining company"
"amm17681","butte central copper mining smelting company"
"amm17692","butte boston consolidated copper silver mining company"
"amm17693","butte boston consolidated copper silver mining company"
"amm1772","longfellow cons mines company"
"amm1773","longfellow cons mines company"
"amm17796","gladstone gold mine com et vale"
"amm17813","granite bimetallic cons mining company"
"amm17832","johannesburg mining milling company"
"amm17880","montreal mining company"
"amm17881","montreal mining company"
"amm17899","new york montana mines company"
"amm17900","new york montana mines company"
"amm17955","silver cable mining company"
"amm17960","silver fissure silver mining company"
"amm17981","triangle mining company"
"amm18046","black hawk consolidated mining company"
"amm1806","medina gold mines ltd"
"amm18069","bull frog gold mining company"
"amm1807","medina gold mines ltd"
"amm18070","bull frog gold mining company"
"amm1808","medina gold mines ltd"
"amm18082","charles butters company"
"amm18083","charles butters company"
"amm18116","consolidated bultfontein mine ltd"
"amm18118","consolidated bultfontein mine ltd"
"amm18130","crown point gold mine ltd"
"amm18192","wilfley mining machinery company"
"amm18194","esmeralda consolidated mines mexico ltd"
"amm18294","jumbo extension mining company"
"amm18384","montana tonopah mines company"
"amm18423","nevada eagle mining company"
"amm18482","overland gold mining company"
"amm18513","pittsburgh silver peak gold m company"
"amm1855","mount jefferson gold mining company"
"amm1856","mount jefferson gold mining company"
"amm18569","santa fe mining company"
"amm18570","santa fe mining company"
"amm18603","steptoe valley smelting mining company"
"amm18610","steptoe valley smelting mining company"
"amm18664","western nevada copper company"
"amm18684","yerington copper company"
"amm18686","yerington malachite copper company"
"amm18726","american mining exploration company"
"amm18727","american mining exploration company"
"amm18787","empire copper mining company"
"amm18912","santa fe gold copper company"
"amm18920","shamrock mining company"
"amm18940","stene consolidated copper company"
"amm19009","almeda consolidated mines "
"amm19010","almeda consolidated mines "
"amm19030","black butte quicksilver mining company"
"amm19046","columbia cold mining company"
"amm19050","combination mines company"
"amm19074","eastern oregon mining company"
"amm19081","el toro mining company"
"amm19088","gold peak mining company"
"amm19130","michigan mining milling company"
"amm19140","igo consolidated mines igo ogp"
"amm19184","sanger gold mines company"
"amm19195","stampede mining milling company"
"amm19196","stampede mining milling company"
"amm19199","sterling mining and milling company"
"amm19200","sterling mining and milling company"
"amm1924","nonpareil gold syndicate ltd"
"amm1925","nonpareil gold syndicate ltd"
"amm19265","electric lamps ensure economy"
"amm19390","american exploration and development corporation"
"amm19400","american swedo iron company"
"amm19464","bullion coalition mines stockton lgp"
"amm19480","carisa copper gold mining company"
"amm19483","keffi consolidated tin ltd"
"amm19494","century gold mining milling company"
"amm19604","gemini godiva consolidated mining company"
"amm19615","gold spring mining company"
"amm19671","iron king consolidated mining company"
"amm19680","kennan mining company"
"amm19695","little bell consolidated mining company"
"amm19801","plutus mining company"
"amm19807","promontorio mining company"
"amm19833","scranton mining g smelting company"
"amm19856","peak silver mining company"
"amm19873","south columbus consolidated mining company"
"amm2","gold mines"
"amm20004","ida mining milling company"
"amm20083","ibex mining company"
"amm2013","pyrenees gold mining company"
"amm2014","pyrenees gold mining company"
"amm20152","mirasol mining company"
"amm20176","palmer mountain tunnel power company"
"amm2018","queen esther mining company"
"amm2019","queen esther mining company"
"amm2020","queen esther mining company"
"amm2021","queen esther mining company"
"amm20250","cliff gold mining company"
"amm20254","grand oak mining company"
"amm20348","beryl gold mining milling company"
"amm20350","beryl gold mining milling company"
"amm20373","san fernando copper mining smelting company"
"amm20390","alvarado mining g milling company"
"amm20419","august mining company"
"amm20420","august mining company"
"amm20421","baldomero mining company"
"amm20422","baldomero mining company"
"amm20468","descubridora mining smelting company"
"amm20516","ibarra mining company"
"amm20557","laredo mining company"
"amm20565","manitou mining company"
"amm20582","molly gibson mining company"
"amm20622","princess mining company"
"amm20674","san pedro mining milling company"
"amm20711","tecoletes mines santa barbara "
"amm20797","enachu and diam inrng ltd"
"amm20845","parrena mining company"
"amm20878","phoenix coal company"
